{
  "$schema": "./market-layers.schema.json",
  "schema": "omdsh-market-layers/v2",
  "generatedAt": "2026-08-14T05:42:30.547Z",
  "policy": {
    "pluginCatalog": "catalog.json remains the leaf-plugin authority",
    "installationRegistry": "registry-v1.json remains the only installation authority",
    "infrastructure": "Genuine DSH clients, managers, marketplaces, integrations, and developer tools are displayed separately from leaf plugins.",
    "distribution": "Genuine plugin collections and community distributions are displayed without inheriting installation authority from components.",
    "excluded": "Awesome/documentation, templates/placeholders, and Topic-only traffic matches without a DSH work claim remain outside the market."
  },
  "totals": {
    "projects": 129,
    "infrastructure": 116,
    "distribution": 13
  },
  "projects": [
    {
      "id": "omdsh-dev/dsh-mygo",
      "layer": "infrastructure",
      "name": "dsh-mygo",
      "description": "面向 DSH 生态的插件管理与治理框架，包含核心、CLI、面板和存储扩展。",
      "kind": "manager",
      "category": "infrastructure",
      "tags": [
        "dsh",
        "plugin-manager",
        "ecosystem-infrastructure"
      ],
      "author": {
        "name": "omdsh-dev",
        "url": "https://github.com/omdsh-dev"
      },
      "source": {
        "repository": "https://github.com/omdsh-dev/dsh-mygo",
        "ref": "4566748646823f8e2123f6addcf22b55e305e740",
        "path": null
      },
      "updatedAt": "2026-08-13T07:54:45.000Z",
      "version": "0.0.1-rc.1",
      "license": "MIT",
      "featured": true,
      "discovery": {
        "stars": 3,
        "commitUpdatedAt": "2026-08-13T07:54:45.000Z"
      },
      "review": {
        "state": "curated",
        "reason": "ecosystem-infrastructure"
      },
      "verification": {
        "state": "static-reviewed",
        "evidence": "topic-plugin-audit.json#omdsh-dev/dsh-mygo"
      },
      "registry": {
        "state": "ineligible",
        "reason": "market-layer-not-plugin-install"
      }
    },
    {
      "id": "omdsh-dev/dsh-hub",
      "layer": "infrastructure",
      "name": "DSH Hub",
      "description": "面向终端用户的市场消费端，用于浏览并消费 Workshop 的公共 Feed。",
      "kind": "manager",
      "category": "infrastructure",
      "tags": [
        "dsh",
        "marketplace-consumer",
        "plugin-marketplace"
      ],
      "author": {
        "name": "omdsh-dev",
        "url": "https://github.com/omdsh-dev"
      },
      "source": {
        "repository": "https://github.com/omdsh-dev/dsh-hub",
        "ref": "82c958c945542064cbdf3eeb2bb408f95187bfc0",
        "path": null
      },
      "updatedAt": "2026-08-13T13:18:23.000Z",
      "version": null,
      "license": "Unknown",
      "featured": false,
      "discovery": {
        "stars": 1,
        "commitUpdatedAt": "2026-08-13T13:18:23.000Z"
      },
      "review": {
        "state": "curated",
        "reason": "ecosystem-infrastructure"
      },
      "verification": {
        "state": "source-pinned",
        "evidence": "public GitHub commit"
      },
      "registry": {
        "state": "ineligible",
        "reason": "market-layer-not-plugin-install"
      }
    },
    {
      "id": "omdsh-dev/dsh-hub-workshop",
      "layer": "infrastructure",
      "name": "DSH Hub Workshop",
      "description": "OMDSH 生态的公开目录、审核投影与不可变 Feed 权威源。",
      "kind": "manager",
      "category": "infrastructure",
      "tags": [
        "dsh",
        "catalog",
        "plugin-marketplace",
        "plugin-registry"
      ],
      "author": {
        "name": "omdsh-dev",
        "url": "https://github.com/omdsh-dev"
      },
      "source": {
        "repository": "https://github.com/omdsh-dev/dsh-hub-workshop",
        "ref": "ca595d6c7534d8542232cd7df34e0e921eb4abc3",
        "path": null
      },
      "updatedAt": "2026-08-13T14:09:05.000Z",
      "version": null,
      "license": "Unknown",
      "featured": false,
      "discovery": {
        "stars": 0,
        "commitUpdatedAt": "2026-08-13T14:09:05.000Z"
      },
      "review": {
        "state": "curated",
        "reason": "ecosystem-infrastructure"
      },
      "verification": {
        "state": "source-pinned",
        "evidence": "public GitHub commit"
      },
      "registry": {
        "state": "ineligible",
        "reason": "market-layer-not-plugin-install"
      }
    },
    {
      "id": "omdsh-dev/omdsh",
      "layer": "distribution",
      "name": "Oh My DSH",
      "description": "社区发行版与精确发行清单层，用于组织经过审核的组件组合。",
      "kind": "toolkit",
      "category": "platform",
      "tags": [
        "dsh",
        "distribution",
        "community-release"
      ],
      "author": {
        "name": "omdsh-dev",
        "url": "https://github.com/omdsh-dev"
      },
      "source": {
        "repository": "https://github.com/omdsh-dev/omdsh",
        "ref": "8affdc1b9e7ad3b5e70fc6b7772f7d95ff2384de",
        "path": null
      },
      "updatedAt": "2026-08-13T13:19:16.000Z",
      "version": null,
      "license": "MIT",
      "featured": false,
      "discovery": {
        "stars": 0,
        "commitUpdatedAt": "2026-08-13T13:19:16.000Z"
      },
      "review": {
        "state": "curated",
        "reason": "community-distribution"
      },
      "verification": {
        "state": "source-pinned",
        "evidence": "public GitHub commit"
      },
      "registry": {
        "state": "ineligible",
        "reason": "market-layer-not-plugin-install"
      }
    },
    {
      "id": "omdsh-dev/omdsh-runtime",
      "layer": "infrastructure",
      "name": "OMDSH Runtime",
      "description": "负责 Profile、Bundle、候选代际和恢复语义的无头运行时。",
      "kind": "manager",
      "category": "infrastructure",
      "tags": [
        "dsh",
        "runtime",
        "profile-management"
      ],
      "author": {
        "name": "omdsh-dev",
        "url": "https://github.com/omdsh-dev"
      },
      "source": {
        "repository": "https://github.com/omdsh-dev/omdsh-runtime",
        "ref": "7b63a27edef055a1c35d97d97651e78d41ea8a2f",
        "path": null
      },
      "updatedAt": "2026-08-13T13:18:16.000Z",
      "version": null,
      "license": "Unknown",
      "featured": false,
      "discovery": {
        "stars": 0,
        "commitUpdatedAt": "2026-08-13T13:18:16.000Z"
      },
      "review": {
        "state": "curated",
        "reason": "ecosystem-infrastructure"
      },
      "verification": {
        "state": "source-pinned",
        "evidence": "public GitHub commit"
      },
      "registry": {
        "state": "ineligible",
        "reason": "market-layer-not-plugin-install"
      }
    },
    {
      "id": "ccch1mneyyy/dsh-tui",
      "layer": "infrastructure",
      "name": "dsh-TUI",
      "description": "解决DSH 官方尚无终端 TUI 痛点的补位之作，献给偏爱cli的各位极客：Claude Code 风格全屏交互终端插件——像素鲸鱼顶栏、实时工作状态行、思考流式展开、双击 Esc 回滚、上下文进度条 + TPS 仪表。npm 一键安装。",
      "kind": "application",
      "category": "infrastructure",
      "tags": [
        "dsh",
        "ecosystem-infrastructure"
      ],
      "author": {
        "name": "ccch1mneyyy",
        "url": "https://github.com/ccch1mneyyy"
      },
      "source": {
        "repository": "https://github.com/ccch1mneyyy/dsh-TUI",
        "ref": "main",
        "path": null
      },
      "updatedAt": "2026-08-14T05:38:12Z",
      "version": null,
      "license": "未声明",
      "featured": false,
      "discovery": {
        "stars": 533,
        "commitUpdatedAt": "2026-08-14T05:38:12Z",
        "metadataUpdatedAt": "2026-08-14T05:41:01Z",
        "archived": false
      },
      "review": {
        "state": "pending-review",
        "reason": "ecosystem-infrastructure"
      },
      "verification": {
        "state": "unverified",
        "evidence": "GitHub Topic metadata and explicit DSH project claim; source review pending"
      },
      "registry": {
        "state": "ineligible",
        "reason": "market-layer-not-plugin-install"
      }
    },
    {
      "id": "pm-shawn/abu-cowork",
      "layer": "infrastructure",
      "name": "Abu-Cowork",
      "description": "Open-source alternative to Claude Cowork — a local-first AI agent desktop app · multi-model · self-evolving skills · privacy-first · multi-Harness roadmap · DeepSeek Harness integration in progress",
      "kind": "application",
      "category": "infrastructure",
      "tags": [
        "dsh",
        "ecosystem-infrastructure"
      ],
      "author": {
        "name": "PM-Shawn",
        "url": "https://github.com/PM-Shawn"
      },
      "source": {
        "repository": "https://github.com/PM-Shawn/Abu-Cowork",
        "ref": "main",
        "path": null
      },
      "updatedAt": "2026-08-14T03:32:36Z",
      "version": null,
      "license": "未声明",
      "featured": false,
      "discovery": {
        "stars": 313,
        "commitUpdatedAt": "2026-08-14T03:32:36Z",
        "metadataUpdatedAt": "2026-08-14T05:35:20Z",
        "archived": false
      },
      "review": {
        "state": "pending-review",
        "reason": "ecosystem-infrastructure"
      },
      "verification": {
        "state": "unverified",
        "evidence": "GitHub Topic metadata and explicit DSH project claim; source review pending"
      },
      "registry": {
        "state": "ineligible",
        "reason": "market-layer-not-plugin-install"
      }
    },
    {
      "id": "hust-open-atom-club/oh-dsh",
      "layer": "distribution",
      "name": "oh-dsh",
      "description": "一站式 DeepSeek Harness 社区发行版：TUI、桌面端与 Web UI 三种形态统一体验，支持分层安装、一步到位，免去手工整合打包。",
      "kind": "collection",
      "category": "platform",
      "tags": [
        "dsh",
        "community-distribution"
      ],
      "author": {
        "name": "hust-open-atom-club",
        "url": "https://github.com/hust-open-atom-club"
      },
      "source": {
        "repository": "https://github.com/hust-open-atom-club/oh-dsh",
        "ref": "main",
        "path": null
      },
      "updatedAt": "2026-08-14T04:39:25Z",
      "version": null,